{
  "schema_version": 1,
  "track": "CCAR-P",
  "domain": 5,
  "unofficial": true,
  "notice": "Independently authored practice questions. Not official Anthropic exam content and not drawn from any exam.",
  "questions": [
    {
      "id": "CCAR-P-D5-001",
      "objective": "CCAR-P-5.1",
      "type": "multiple",
      "select": 3,
      "difficulty": "advanced",
      "category": "architecture",
      "scenario": "Kestrel Payments is designing guardrails for a merchant-support assistant that can look up transactions and issue small goodwill credits up to a fixed limit.",
      "question": "Which THREE controls form a sound layered guardrail design? (Choose 3.)",
      "options": {
        "A": "Screen inputs with a lightweight classifier for abuse and injection patterns before the main model call",
        "B": "Enforce credit caps and daily per-merchant totals in the credit tool's backend, independent of the model",
        "C": "Scan outputs for sensitive data such as full card numbers before they reach the user",
        "D": "Rely on a system-prompt rule that the assistant must never exceed the credit limit",
        "E": "Let the model decide when a credit is justified with no further checks, because it has good judgement"
      },
      "answer": [
        "A",
        "B",
        "C"
      ],
      "explanation": "Effective guardrails are layered and the strongest ones are deterministic. Input screening (for example a fast classifier for abuse or injection patterns) reduces risk early. Hard limits enforced in the credit tool's backend (amount caps, per-merchant daily totals) hold regardless of what the model says. Output checks for sensitive data such as full card numbers stop leakage. Relying on the system prompt or a single model's judgement alone is not a guardrail architecture.",
      "why_incorrect": {
        "D": "A prompt rule is guidance, not enforcement; the backend must enforce limits.",
        "E": "Unchecked model discretion over money is the excessive-agency risk guardrails exist to contain."
      },
      "module": "12-ai-security/14-enterprise-deployment-controls.md",
      "references": [
        "https://platform.claude.com/docs/en/test-and-evaluate/strengthen-guardrails/mitigate-jailbreaks",
        "https://genai.owasp.org/llmrisk/llm062025-excessive-agency/"
      ]
    },
    {
      "id": "CCAR-P-D5-002",
      "objective": "CCAR-P-5.1",
      "type": "single",
      "difficulty": "intermediate",
      "category": "scenario",
      "scenario": "Fourth Coffee's public chatbot occasionally gets attempts to make it write abusive content about competitors. The team wants a cheap pre-screen before the main model runs.",
      "question": "Which design is most appropriate?",
      "options": {
        "A": "A static keyword blocklist only",
        "B": "Generate the response first and screen only the output",
        "C": "A fast, low-cost model call that classifies each input against a defined policy and returns a structured verdict, with flagged inputs routed to a safe fallback",
        "D": "Ask users to agree to terms of use before chatting"
      },
      "answer": [
        "C"
      ],
      "explanation": "A common harmlessness-screening pattern is a fast, low-cost model call that classifies user input against a defined policy and returns a structured verdict, with flagged inputs routed to a safe response or review. It runs before the main model, adds little latency and can be tuned and evaluated independently. Blocklists alone are easy to evade, and screening only after generation wastes cost and risks exposure.",
      "why_incorrect": {
        "A": "Keyword lists are easily evaded and generate false positives.",
        "B": "Output screening is useful as a second layer, but without input screening every abusive prompt incurs the main model's cost.",
        "D": "Terms set expectations but do not technically prevent abuse."
      },
      "module": "12-ai-security/02-prompt-injection.md",
      "references": [
        "https://platform.claude.com/docs/en/test-and-evaluate/strengthen-guardrails/mitigate-jailbreaks"
      ]
    },
    {
      "id": "CCAR-P-D5-003",
      "objective": "CCAR-P-5.1",
      "type": "single",
      "difficulty": "advanced",
      "category": "security",
      "scenario": "Proseware's coding agent runs shell commands in CI. A security review asks how to prevent it from exfiltrating secrets to arbitrary internet hosts if it is manipulated by malicious content in a dependency's README.",
      "question": "Which guardrail is most effective?",
      "options": {
        "A": "Add a prompt instruction not to send secrets anywhere",
        "B": "Review CI logs weekly for suspicious outbound requests",
        "C": "Use a more capable model so it recognises malicious README content",
        "D": "Run the agent in a sandbox with egress restricted to an allowlist of required hosts and with only the minimum secrets available"
      },
      "answer": [
        "D"
      ],
      "explanation": "Network and filesystem isolation enforced by the environment is a hard boundary that holds even if the agent is manipulated. Running the agent in a sandbox whose egress is restricted to an allowlist of required hosts, with no secrets mounted beyond those strictly needed, prevents exfiltration regardless of the model's behaviour. Prompt warnings and post-hoc log review do not prevent the action.",
      "why_incorrect": {
        "A": "Instructions can be overridden by injected content; they do not block network access.",
        "B": "Detection after the fact does not prevent the exfiltration.",
        "C": "Capability helps but is not a guaranteed boundary."
      },
      "module": "12-ai-security/07-supply-chain-risks.md",
      "references": [
        "https://code.claude.com/docs/en/sandboxing",
        "https://genai.owasp.org/llmrisk/llm01-prompt-injection/"
      ]
    },
    {
      "id": "CCAR-P-D5-004",
      "objective": "CCAR-P-5.1",
      "type": "single",
      "difficulty": "intermediate",
      "category": "troubleshooting",
      "scenario": "Civic Benefits Agency's guardrail classifier blocks 6% of legitimate questions about domestic-violence support services, frustrating vulnerable users.",
      "question": "What is the best response?",
      "options": {
        "A": "Add legitimate sensitive-topic queries to the guardrail eval, refine the policy with allowed and disallowed examples, and route borderline cases to a helpful safe response instead of a hard block",
        "B": "Remove the guardrail entirely",
        "C": "Accept the false positives as the cost of safety",
        "D": "Add 'domestic violence' to an allowlist that bypasses all checks"
      },
      "answer": [
        "A"
      ],
      "explanation": "Guardrails have false positives as well as false negatives, and both need measurement. The team should build an evaluation set that includes legitimate sensitive-topic queries, tune the policy and classifier prompt with examples of allowed versus disallowed requests, and route borderline cases to a safe, helpful response (for example signposting support services) rather than a hard block. Removing the guardrail or accepting the harm to users are both poor trade-offs.",
      "why_incorrect": {
        "B": "This removes protection against genuinely harmful requests.",
        "C": "Blocking vulnerable users from support information is itself a harm that should be reduced.",
        "D": "A blanket bypass can be abused by attackers who include the phrase."
      },
      "module": "12-ai-security/14-enterprise-deployment-controls.md",
      "references": [
        "https://platform.claude.com/docs/en/test-and-evaluate/strengthen-guardrails/mitigate-jailbreaks"
      ]
    },
    {
      "id": "CCAR-P-D5-005",
      "objective": "CCAR-P-5.2",
      "type": "single",
      "difficulty": "advanced",
      "category": "security",
      "scenario": "Adatum Pharma's research agent can browse the web, read internal documents and send email. A threat-modelling workshop is identifying the most serious failure mode.",
      "question": "Which risk combination is most serious and why?",
      "options": {
        "A": "Occasional hallucinated citations in research summaries",
        "B": "Untrusted web content, access to internal documents and the ability to email externally together enable injection-driven data exfiltration",
        "C": "Higher token cost from browsing",
        "D": "Slow responses when many documents are read"
      },
      "answer": [
        "B"
      ],
      "explanation": "The most dangerous combination in agentic systems is access to private data, exposure to untrusted content and the ability to communicate externally. Together they allow an indirect prompt injection in a web page to instruct the agent to read internal documents and email them out. Breaking any leg of that combination, for example by removing external email or isolating untrusted content from private data access, sharply reduces risk.",
      "why_incorrect": {
        "A": "A real quality risk, but far less severe than data exfiltration.",
        "C": "Cost is an operational concern, not the most serious security failure mode.",
        "D": "Latency affects user experience, not security."
      },
      "module": "12-ai-security/01-llm-threat-modelling.md",
      "references": [
        "https://genai.owasp.org/llmrisk/llm01-prompt-injection/",
        "https://genai.owasp.org/llmrisk/llm022025-sensitive-information-disclosure/"
      ]
    },
    {
      "id": "CCAR-P-D5-006",
      "objective": "CCAR-P-5.2",
      "type": "multiple",
      "select": 2,
      "difficulty": "intermediate",
      "category": "concept",
      "scenario": "A product manager at Wingtip Toys says 'Claude is deterministic if we use the same prompt, so we can skip regression testing after we change unrelated code'.",